Title;Rating;Image;Demography;Genres;Year;List
SPY X FAMILY;9.21/10;https://otakuteca.com/images/books/cover/5cbe51e196611.jpg;Shounen;Acción, Comedia, Familia, Romance, Drama, Recuentos de la vida;2019;Siguiendo
Stalkers;0.00/10;https://otakuteca.com/images/books/cover/5c16d87859340.jpg;Shounen;Comedia, Romance;2018;Siguiendo
Sukinako ga Megane wo wasureta;9.75/10;https://otakuteca.com/images/books/cover/61bc736fea076.jpg;Shounen;Comedia, Vida Escolar, Romance, Recuentos de la vida;2018;Siguiendo
Takane no hana nara ochitekoi!!;9.08/10;https://otakuteca.com/images/books/cover/638beb66e64dc.jpg;Shounen;Comedia, Recuentos de la vida, Romance, Vida Escolar, Drama;2015 - 2019;Siguiendo
The Maid Who Can't Hide Her Feelings;0.00/10;https://otakuteca.com/images/books/cover/5d7d332261d56.jpg;Shounen;Comedia, Romance;2019;Siguiendo
Tobakushi wa Inoranai;0.00/10;https://otakuteca.com/images/books/cover/5ba7ec77a9183.jpg;Seinen;Drama, Historia, Realidad, Romance, Tragedia;2018;Siguiendo
Tokyo Revengers;7.10/10;https://otakuteca.com/images/books/cover/64234208ee646.jpg;Shounen;Acción, Drama, Romance, Vida Escolar, Misterio, Sobrenatural, Tragedia;2017 - 2022;Siguiendo
Tonari no Baka to Tsudzuku Uso;8.00/10;https://otakuteca.com/images/books/cover/5d7468dc2c51a.jpg;Shoujo;Comedia, Ecchi, Romance, Vida Escolar, Recuentos de la vida;2019;Siguiendo
Tonikaku Kawaii;8.44/10;https://otakuteca.com/images/books/cover/614fa8c82fce9.jpg;Shounen;Comedia, Romance, Recuentos de la vida, Familia, Historia, Misterio, Ciencia Ficción;2018;Siguiendo
Torture Tournament;0.00/10;https://otakuteca.com/images/books/cover/5b4eee33430bb.jpg;Seinen;Acción, Gore, Horror;2017;Siguiendo
Tsuki no Oki ni Mesu mama;0.00/10;https://otakuteca.com/images/books/cover/5e888db25554f.jpg;Shoujo;Romance, Vida Escolar, Recuentos de la vida;2020;Siguiendo
Tsurenai Kanojo no Hitorijime;10.00/10;https://otakuteca.com/images/books/cover/62598365e6bda.jpg;Josei;Drama, Romance, Recuentos de la vida;2021;Siguiendo
uchi no hentai maid;9.50/10;https://otakuteca.com/images/books/cover/5ccbae854c2d6.jpg;Shounen;Comedia, Ecchi, Romance, Recuentos de la vida, Harem;2018;Siguiendo
A Cute Girlfriend.;7.77/10;https://otakuteca.com/images/books/cover/63b2b1bfc6e55.jpg;Shounen;Romance, Recuentos de la vida, Crimen, Drama, Misterio, Psicológico;2022;Siguiendo
Ura de Yancha-na Gouinda-san;0.00/10;https://otakuteca.com/images/books/cover/641a8f9196d89.jpg;Shounen;Comedia, Ecchi, Romance, Vida Escolar;2023;Siguiendo
Urami-san wa Kyou mo Ayaui;5.50/10;https://otakuteca.com/images/books/cover/37361_TMOManga5ab4447536622.jpg;Shounen;Romance, Comedia, Vida Escolar, Recuentos de la vida;2017;Siguiendo
Vinland Saga;9.00/10;https://otakuteca.com/images/books/cover/9715_TMOmanga162946.jpg;Seinen;Acción, Aventura, Drama, Historia, Gore, Psicológico, Tragedia;2005;Siguiendo
Watari-kun no xx ga Houkai Sunzen;9.00/10;https://otakuteca.com/images/books/cover/5f2f922b901dd.jpg;Seinen;Comedia, Recuentos de la vida, Ecchi, Romance, Harem, Vida Escolar;2014;Siguiendo
Watashi no Shounen;9.04/10;https://otakuteca.com/images/books/cover/6312aee97cd85.jpg;Seinen;Psicológico, Romance, Recuentos de la vida, Drama;2015 - 2020;Siguiendo
The Promised Neverland;8.69/10;https://otakuteca.com/images/books/cover/5ba2a0852dc2e.jpg;Shounen;Demonios, Ciencia Ficción, Misterio, Horror, Acción, Psicológico, Drama;2016 - 2020;Siguiendo
Yamada-kun to Lv999 no Koi wo Suru;9.09/10;https://otakuteca.com/images/books/cover/633e296518275.jpg;Shoujo;Drama, Romance, Comedia;2019;Siguiendo
Yuujin-chara no Ore ga Motemakuru Wakenaidarou?;9.00/10;https://otakuteca.com/images/books/cover/5d39bbfb34136.jpg;Shounen;Comedia, Harem, Romance, Vida Escolar;2019;Siguiendo
Binetsu Kuukan;8.67/10;https://otakuteca.com/images/books/cover/5cbe070127d11.jpg;Josei;Comedia, Romance;2014;Favorito
Boku no Kokoro no Yabai Yatsu;8.77/10;https://otakuteca.com/images/books/cover/60f4daf40dc87.jpg;Shounen;Recuentos de la vida, Vida Escolar, Comedia, Romance;2018;Favorito
Hiiragi-san Chi no Kyuuketsu Jijou;7.00/10;https://otakuteca.com/images/books/cover/6410227a103cd.jpg;Shounen;Comedia, Familia, Romance, Vampiros;2021;Favorito
Grand Blue;8.81/10;https://otakuteca.com/images/books/cover/6190474616ca1.jpg;Seinen;Ecchi, Romance, Vida Escolar, Recuentos de la vida, Deporte, Comedia;2014;Favorito
Isshiki-san wa Koi wo Shiritai;9.25/10;https://otakuteca.com/images/books/cover/647e97b0bcab9.jpg;Shounen;Comedia, Historia, Romance, Recuentos de la vida;2020;Favorito
Kanojo mo Kanojo;8.98/10;https://otakuteca.com/images/books/cover/6134315b6229b.jpg;Shounen;Comedia, Romance, Vida Escolar, Harem, Drama, Recuentos de la vida;2020 - 2023;Favorito
Karakai Jouzu no Takagi-san;9.05/10;https://otakuteca.com/images/books/cover/5b36505db2687.jpg;Shounen;Comedia, Romance, Vida Escolar, Recuentos de la vida;2012;Favorito
Mikadono Sanshimai wa Angai, Choroi;8.20/10;https://otakuteca.com/images/books/cover/6357091469fb6.jpg;Shounen;Comedia, Harem, Romance;2021;Favorito
Oroka na Tenshi wa Akuma to Odoru;9.25/10;https://otakuteca.com/images/books/cover/5ed9156c7b184.jpg;Seinen;Acción, Comedia, Vida Escolar, Romance, Demonios, Drama, Magia;2016;Favorito
Re:Zero Kara Hajimeru Isekai Seikatsu;10.00/10;https://otakuteca.com/images/books/cover/64f77458977c7.jpg;Seinen;Drama, Fantasia, Gore, Tragedia, Misterio, Psicológico, Supervivencia;2012;Favorito
Reincarne;0.00/10;https://otakuteca.com/images/books/cover/61876f811b5de.jpg;Shounen;Comedia, Ecchi, Género Bender, Harem, Reencarnación, Romance;2021;Favorito
Soredemo Ayumu wa Yosetekuru;9.50/10;https://otakuteca.com/images/books/cover/609ebaa9d1385.jpg;Shounen;Comedia, Romance, Vida Escolar, Recuentos de la vida;2019;Favorito
Temple;10.00/10;https://otakuteca.com/images/books/cover/5e710b46500cd.jpg;Shounen;Comedia, Ecchi, Harem, Romance, Recuentos de la vida;2018;Favorito
The Breaker: Eternal Force;10.00/10;https://otakuteca.com/images/books/cover/6274088103fc4.jpg;Shounen;Acción, Aventura, Drama, Artes Marciales, Comedia, Romance, Vida Escolar;2022;Favorito
I Favour the Villainess;10.00/10;https://otakuteca.com/images/books/cover/5d5498e42b9ea.jpg;Shoujo;Comedia, Drama, Fantasia, Romance, Vida Escolar, Girls Love;;Abandonado
