Title;Rating;Image;Demography;Genres;Year;List
Oshi No Ko;9.20/10;https://otakuteca.com/images/books/cover/5efe4afd1d0c5.jpg;Seinen;Drama, Psicológico, Romance, Reencarnación, Familia, Misterio, Recuentos de la vida;2020;Siguiendo
Las Siete Bellas Durmientes;0.00/10;https://otakuteca.com/images/books/cover/642386451ff0f.jpg;Seinen;Comedia, Fantasia, Harem, Romance;2023;Siguiendo
Adachi To Shimamura (Moke ver.);7.00/10;https://otakuteca.com/images/books/cover/60ef905f6947d.jpg;Shoujo;Girls Love, Romance, Vida Escolar;2019;Siguiendo
Aitsu no Kanojo;6.63/10;https://otakuteca.com/images/books/cover/64d47fa4bd6e6.jpg;Seinen;Comedia, Ecchi, Vida Escolar, Drama, Romance;2022;Siguiendo
Akuyaku Ouji wa Koi ga Dekinai;6.00/10;https://otakuteca.com/images/books/cover/62d88ae0a6df9.jpg;Shounen;Comedia, Romance, Vida Escolar;2017 - 2018;Siguiendo
The Villainess Noble Girl Wants to Slim Down Her Husband;9.00/10;https://otakuteca.com/images/books/cover/5c9061b105fba.jpg;Shoujo;Drama, Fantasia, Romance, Recuentos de la vida;;Siguiendo
Ao no Orchestra;10.00/10;https://otakuteca.com/images/books/cover/622d3e96a50d4.jpg;Shounen;Drama, Romance, Vida Escolar, Recuentos de la vida, Comedia, Musica;2017;Siguiendo
Assassin's Pride;8.56/10;https://otakuteca.com/images/books/cover/607de16b3ddf2.jpg;Seinen;Acción, Aventura, Comedia, Ecchi, Fantasia, Harem, Artes Marciales, Misterio, Romance;2017;Siguiendo
Aunque sea en una sola cosa... ¡Lo superaré!;0.00/10;https://otakuteca.com/images/books/cover/5c87f6f7bf7c7.jpg;Shounen;Comedia, Drama, Familia, Romance, Vida Escolar;2019;Siguiendo
Bandai Kaname wa Asobitai;8.00/10;https://otakuteca.com/images/books/cover/5b79da6d8f941.jpg;Shounen;Comedia, Romance, Vida Escolar, Ecchi;2017;Siguiendo
Ittsumo Shio Taiou na Osananajimi da kedo, Ore ni Kataomoi Shiteiru no ga Bare Bare de Kawaii;8.00/10;https://otakuteca.com/images/books/cover/61d08056318d8.jpg;Shounen;Comedia, Romance, Recuentos de la vida;2021;Siguiendo
Tonari no Seki no Satou-san;10.00/10;https://otakuteca.com/images/books/cover/5efd0c9c4a102.jpg;Seinen;Romance, Vida Escolar, Recuentos de la vida;2019 - 2020;Siguiendo
Save & Load no Dekiru Yadoya-San;10.00/10;https://otakuteca.com/images/books/cover/5e349eba44cbf.jpg;Shounen;Acción, Aventura, Comedia, Fantasia, Harem;2018;Siguiendo
The Swordsman Called the Countless Swords Sorcerer;9.40/10;https://otakuteca.com/images/books/cover/6106f8ce7174c.jpg;Shounen;Acción, Aventura, Niños, Tragedia, Fantasia, Magia, Drama;2019;Siguiendo
Black Clover;8.05/10;https://otakuteca.com/images/books/cover/64c00b2373118.jpg;Shounen;Acción, Comedia, Fantasia, Magia, Aventura, Romance, Superpoderes;2015;Siguiendo
Black Kanojo;6.00/10;https://otakuteca.com/images/books/cover/5e35d05f6e419.jpg;Seinen;Comedia, Drama, Ecchi, Gore, Romance, Vida Escolar, Harem;2015 - 2017;Siguiendo
Blue Lock;8.32/10;https://otakuteca.com/images/books/cover/5d07c1d52967b.jpg;Shounen;Deporte, Acción, Drama, Psicológico, Supervivencia;2018;Siguiendo
"""Ella vino a la fuerza hacia a mí""";8.80/10;https://otakuteca.com/images/books/cover/61ccc9c49d3e8.jpg;Seinen;Comedia, Romance, Recuentos de la vida;2021;Siguiendo
Bokutachi wa Benkyou ga Dekinai;8.47/10;https://otakuteca.com/images/books/cover/5cabf0bda739f.jpg;Shounen;Comedia, Romance, Vida Escolar, Harem, Drama, Recuentos de la vida;2017 - 2021;Siguiendo
Buta Koushaku ni Tensei Shitakara, Kondo wa Kimi ni Suki to Iitai;7.50/10;https://otakuteca.com/images/books/cover/6052dd1ba7431.jpg;Shounen;Aventura, Comedia, Fantasia, Romance, Vida Escolar, Recuentos de la vida;2017;Siguiendo
Chainsaw Man;8.88/10;https://otakuteca.com/images/books/cover/5cca10a79a95e.jpg;Shounen;Acción, Horror, Sobrenatural, Demonios, Comedia, Fantasia, Romance;2018;Siguiendo
CHEAT KUSUSHI NO SLOW LIFE: ISEKAI NI TSUKUROU DRUGSTORE;9.67/10;https://otakuteca.com/images/books/cover/614f06776a39b.jpg;Shounen;Aventura, Comedia, Fantasia, Reencarnación;2018;Siguiendo
Chikotan- Kowareru;9.09/10;https://otakuteca.com/images/books/cover/12934_TMOmanga035540.jpg;Seinen;Comedia, Romance, Ecchi, Harem, Vida Escolar, Sobrenatural, Misterio;2015 - 2016;Siguiendo
ChinChin KemoKemo;0.00/10;https://otakuteca.com/images/books/cover/5ce32cd170a13.jpg;Seinen;Acción, Comedia, Demonios, Ecchi, Fantasia, Romance;2019;Siguiendo
Chocolate Vampire;9.00/10;https://otakuteca.com/images/books/cover/5d1b53328b06e.jpg;Shoujo;Vida Escolar, Romance, Vampiros, Harem, Comedia, Drama;2016;Siguiendo
Chuusotsu Worker kara Hajimeru Koukou Seikatsu Roudousha;8.00/10;https://otakuteca.com/images/books/cover/15313_TMOManga57056e0a477ab.jpg;Seinen;Romance, Vida Escolar, Recuentos de la vida, Drama;2011;Siguiendo
Cinderella wa Sagasanai.;8.00/10;https://otakuteca.com/images/books/cover/5fe90eb445f1f.jpg;Seinen;Comedia, Drama, Romance, Vida Escolar;2020;Siguiendo
Dachi no imouto;10.00/10;https://otakuteca.com/images/books/cover/5f3daf9f79648.jpg;Josei;Comedia, Romance, Vida Escolar;2020;Siguiendo
Darwin's Game;9.29/10;https://otakuteca.com/images/books/cover/648002c8d5640.jpg;Shounen;Acción, Ecchi, Misterio, Psicológico, Ciencia Ficción, Drama, Romance;2012;Siguiendo
Dokuzakura;6.67/10;https://otakuteca.com/images/books/cover/5d520342c8e45.jpg;Seinen;Ecchi, Misterio, Psicológico, Romance, Sobrenatural, Thriller, Harem;2019 - 2020;Siguiendo
Domestic na Kanojo;6.18/10;https://otakuteca.com/images/books/cover/5c6629d99f9e7.jpg;Shounen;Drama, Romance, Vida Escolar, Ecchi, Harem;2014;Siguiendo
Doubt!;9.01/10;https://otakuteca.com/images/books/cover/9272_TMOmanga084430.jpg;Shounen;Comedia, Recuentos de la vida, Ecchi, Romance, Harem, Vida Escolar;2012;Siguiendo
Doukyuusei ni Koi o Shita;2.00/10;https://otakuteca.com/images/books/cover/20363_TMOManga57f161d34d0d2.jpg;Shoujo;Romance, Comedia, Vida Escolar;2016;Siguiendo
Dr. Stone;8.85/10;https://otakuteca.com/images/books/cover/5d924d4309b18.jpg;Shounen;Acción, Aventura, Apocalíptico, Comedia, Supervivencia, Misterio, Ciencia Ficción;2017 - 2022;Siguiendo
Eien Ni Korosare Tsuzukeru Natsu;0.00/10;https://otakuteca.com/images/books/cover/5cfd3254380a1.jpg;Seinen;Horror, Vida Escolar;2019;Siguiendo
Eiyuu Kyoushitsu - Reboot;8.00/10;https://otakuteca.com/images/books/cover/5dfea4fff29d4.jpg;Shounen;Acción, Comedia, Fantasia, Vida Escolar, Ecchi, Harem;2016;Siguiendo
En no Shita no Chikara Mocher: Maou Toubatsu shitara Wakagaetta node, Gakuen de Kage kara Support shimasu;7.00/10;https://otakuteca.com/images/books/cover/621d022556b6c.jpg;Seinen;Comedia, Fantasia, Magia, Romance, Vida Escolar;2022;Siguiendo
Futago, Futagokoro.;5.00/10;https://otakuteca.com/images/books/cover/5f71388652f7f.jpg;Seinen;Drama, Romance, Vida Escolar;2018;Siguiendo
Fuufu Ijou, Koibito Miman.;8.86/10;https://otakuteca.com/images/books/cover/63ba3533878dd.jpg;Seinen;Comedia, Drama, Ecchi, Romance, Vida Escolar, Recuentos de la vida;2018;Siguiendo
Garden Sphere;9.07/10;https://otakuteca.com/images/books/cover/5f6bde465b86f.jpg;Shounen;Romance, Comedia, Fantasia, Aventura, Vida Escolar;2017;Siguiendo
Girigiri Out;5.00/10;https://otakuteca.com/images/books/cover/61df64c472071.jpg;Shounen;Comedia, Ecchi, Romance, Vida Escolar, Harem;2012 - 2018;Siguiendo
Mis primeras veces con Suwa-san;7.50/10;https://otakuteca.com/images/books/cover/643adaf3c24c6.jpg;Seinen;Comedia, Romance;2020;Siguiendo
Hanazono-san Chi no Futago-chan;7.60/10;https://otakuteca.com/images/books/cover/609d81e979046.jpg;Shounen;Comedia, Romance, Vida Escolar, Recuentos de la vida, Drama, Harem;2020 - 2021;Siguiendo
Happy Sugar Life;7.00/10;https://otakuteca.com/images/books/cover/14067_TMOmanga113316.jpg;Seinen;Drama, Horror, Misterio, Psicológico, Girls Love;2015;Siguiendo
Hello World;0.00/10;https://otakuteca.com/images/books/cover/5e3f25b9d2658.jpg;Seinen;Drama, Romance, Vida Escolar, Ciencia Ficción, Sobrenatural;2019 - 2020;Siguiendo
Hensokukei Quadrangle;9.06/10;https://otakuteca.com/images/books/cover/14316_TMOmanga010919.jpg;Shounen;Comedia, Romance, Vida Escolar;2015;Siguiendo
Hige Wo Soru. Soshite Joshikosei Wo Hirou;6.39/10;https://otakuteca.com/images/books/cover/5ecec044774df.jpg;Seinen;Comedia, Drama, Romance, Recuentos de la vida, Telenovela;2018;Siguiendo
Himari no Mawari;0.00/10;https://otakuteca.com/images/books/cover/5d0463185e42b.jpg;Seinen;Comedia, Familia, Romance, Vida Escolar, Recuentos de la vida;2018 - 2020;Siguiendo
Hinako’s My Wife?!;8.00/10;https://otakuteca.com/images/books/cover/5c389e3508209.jpg;Shoujo;Romance, Sobrenatural;2018;Siguiendo
Hinomoto 3-shimai wa Kamatte Hoshii;8.80/10;https://otakuteca.com/images/books/cover/5e0ce8c7e230b.jpg;Seinen;Comedia, Ecchi, Harem, Romance, Recuentos de la vida;2016 - 2018;Siguiendo
Hokenshitsu no Kageyama-kun;6.00/10;https://otakuteca.com/images/books/cover/5d4064f93f26b.jpg;Shoujo;Comedia, Romance, Vida Escolar, Sobrenatural, Vampiros;2017;Siguiendo
Horimiya;7.89/10;https://otakuteca.com/images/books/cover/615de1631925f.jpg;Shounen;Comedia, Recuentos de la vida, Romance, Vida Escolar;2011 - 2021;Siguiendo
Hoshino, Me o Tsubutte;8.89/10;https://otakuteca.com/images/books/cover/5e1e86776fa29.jpg;Shounen;Comedia, Recuentos de la vida, Romance, Vida Escolar, Drama, Harem;2016 - 2018;Siguiendo
The After School Idol Has a Secret;0.00/10;https://otakuteca.com/images/books/cover/648d6c1131507.jpg;Shounen;Musica, Realidad, Romance, Vida Escolar;2022;Siguiendo
Houkago wa Kissaten de;9.09/10;https://otakuteca.com/images/books/cover/35314_TMOManga5a715e1d1eab6.jpg;Shoujo;Romance, Vida Escolar, Comedia, Drama;2017;Siguiendo
I Want To Drink Your Tears;9.00/10;https://otakuteca.com/images/books/cover/5f28427101b28.jpg;Shounen;Comedia, Romance, Vida Escolar, Recuentos de la vida;2020;Siguiendo
Otome Game no Mobu desura naindaga;9.29/10;https://otakuteca.com/images/books/cover/62943be8222a3.jpg;Shounen;Comedia, Fantasia, Reencarnación, Romance, Recuentos de la vida;2021;Siguiendo
Ichijou-san, se te nota en la cara;10.00/10;https://otakuteca.com/images/books/cover/625b4fc43fcd9.jpg;Seinen;Comedia, Romance, Vida Escolar, Sobrenatural, Vampiros;2021;Siguiendo
Ijousha no Ai;6.11/10;https://otakuteca.com/images/books/cover/5ea88207b19cf.jpg;Shounen;Horror, Psicológico, Romance, Tragedia, Gore, Drama;2017 - 2018;Siguiendo
Iris Zero;9.24/10;https://otakuteca.com/images/books/cover/5f1c8ff032132.jpg;Seinen;Comedia, Drama, Fantasia, Sobrenatural, Misterio, Romance, Vida Escolar;2009;Siguiendo
Jaku-Chara Tomozaki-kun;10.00/10;https://otakuteca.com/images/books/cover/34023_TMOManga5a3f6f29836d1.jpg;Shounen;Drama, Harem, Romance, Recuentos de la vida, Comedia;2017;Siguiendo
Jibaku Shounen Hanako-kun;9.23/10;https://otakuteca.com/images/books/cover/61609dae0e751.jpg;Shounen;Acción, Aventura, Drama, Romance, Vida Escolar, Recuentos de la vida, Sobrenatural;2014;Siguiendo
Jingi Naki Mukotori;10.00/10;https://otakuteca.com/images/books/cover/5f98769931b33.jpg;Shoujo;Comedia, Drama, Romance, Vida Escolar;2020;Siguiendo
Jubunnoichi no Hanayome;5.50/10;https://otakuteca.com/images/books/cover/605d33de2a1b4.jpg;Seinen;Drama, Ecchi, Harem, Familia, Telenovela, Recuentos de la vida;2019;Siguiendo
Kaifuku Jutsushi no Yarinaoshi;6.88/10;https://otakuteca.com/images/books/cover/61018c6d9c438.jpg;Seinen;Aventura, Harem, Gore, Ecchi, Reencarnación, Acción, Tragedia;2017;Siguiendo
Kakushigoto - Secrets;0.00/10;https://otakuteca.com/images/books/cover/5b5b33dac4e59.jpg;Seinen;Drama, Vida Escolar, Recuentos de la vida, Sobrenatural;2018;Siguiendo
Kanan-sama Might be Easy;8.92/10;https://otakuteca.com/images/books/cover/629634d78ab1c.jpg;Shounen;Comedia, Demonios, Fantasia, Romance, Recuentos de la vida;2022;Siguiendo
Kanojo ga Flag wo Oraretara;8.92/10;https://otakuteca.com/images/books/cover/5d08acaf04364.jpg;Shounen;Comedia, Recuentos de la vida, Ecchi, Sobrenatural, Romance, Harem, Vida Escolar;2011 - 2015;Siguiendo
Kanojo, Okarishimasu;3.93/10;https://otakuteca.com/images/books/cover/606cda6f538c7.jpg;Shounen;Comedia, Ecchi, Romance, Vida Escolar, Drama;2017;Siguiendo
Kawaii dake ja Nai Shikimori-san;7.35/10;https://otakuteca.com/images/books/cover/5ce7220a590d8.jpg;Shounen;Romance, Vida Escolar, Comedia, Recuentos de la vida;2019 - 2023;Siguiendo
Mechanical Marie;0.00/10;https://otakuteca.com/images/books/cover/606bbd6a6ff56.jpg;Shoujo;Acción, Comedia, Drama, Romance, Recuentos de la vida;2020;Siguiendo
Guardianes de la Noche;8.26/10;https://otakuteca.com/images/books/cover/6347011a463ea.jpg;Shounen;Acción, Demonios, Sobrenatural, Aventura, Fantasia, Tragedia, Historia;2016 - 2020;Siguiendo
I Want to Do Bad Things with You;6.33/10;https://otakuteca.com/images/books/cover/635a26e8569a0.jpg;Shounen;Acción, Comedia, Romance, Vida Escolar;2022;Siguiendo
Amor, clarividencia e inexperiencia;8.50/10;https://otakuteca.com/images/books/cover/62f0b7ed8039b.jpg;Shounen;Comedia, Romance, Vida Escolar;2021;Siguiendo
Koi to Utatane;9.00/10;https://otakuteca.com/images/books/cover/5f8ee38f1a90b.jpg;Shounen;Recuentos de la vida, Romance, Vida Escolar;2017;Siguiendo
Koi wa iikara nemuritai!;7.67/10;https://otakuteca.com/images/books/cover/6094b4ee24c15.jpg;Shounen;Comedia, Ecchi, Romance, Vida Escolar, Harem;2020;Siguiendo
Love After World Domination;8.80/10;https://otakuteca.com/images/books/cover/625072312d9d9.jpg;Shounen;Acción, Aventura, Comedia, Romance, Ciencia Ficción, Sobrenatural;2019 - 2022;Siguiendo
Kokoro Kimi-iro Sakurairo;8.62/10;https://otakuteca.com/images/books/cover/5ff89752bb128.jpg;Shoujo;Romance;2016;Siguiendo
Konna Watashi ni Kitaishinai de;6.67/10;https://otakuteca.com/images/books/cover/5f470be28a5e6.jpg;Seinen;Comedia, Ecchi, Vida Escolar;2020 - 2022;Siguiendo
Kono Gomi o Nanto Yobu;4.00/10;https://otakuteca.com/images/books/cover/62943efead8b4.jpg;Seinen;Comedia, Drama, Psicológico, Romance, Vida Escolar;2020;Siguiendo
Kono Sekai wa Tsuite iru;9.00/10;https://otakuteca.com/images/books/cover/5c9112c76d44b.jpg;Seinen;Comedia, Demonios, Fantasia, Vampiros, Romance;2018;Siguiendo
Kubo-san wa Boku (Mobu) wo Yurusanai;8.38/10;https://otakuteca.com/images/books/cover/5ef13f8de9087.jpg;Shounen;Comedia, Romance, Vida Escolar, Recuentos de la vida;2019 - 2023;Siguiendo
Class no Daikirai na Joshi to Kekkon Suru Koto ni Natta.;9.80/10;https://otakuteca.com/images/books/cover/61cc613677555.jpg;Shounen;Comedia, Romance, Vida Escolar, Recuentos de la vida;2021;Siguiendo
Kuroiwa Medaka Ni Watashi No Kawaii Ga Tsuujinai;8.42/10;https://otakuteca.com/images/books/cover/60f71edeeb668.jpg;Shounen;Comedia, Ecchi, Romance, Vida Escolar, Recuentos de la vida;2021;Siguiendo
The Black Cat and the Witch Classroom;7.00/10;https://otakuteca.com/images/books/cover/632dba2a2b30a.jpg;Shounen;Comedia, Fantasia, Romance, Vida Escolar, Recuentos de la vida, Sobrenatural;2021;Siguiendo
Kusunoki-san wa Koukou Debut ni Shippaishiteiru;10.00/10;https://otakuteca.com/images/books/cover/644bfa214f7f2.jpg;Shounen;Comedia, Romance, Vida Escolar, Recuentos de la vida;2022;Siguiendo
Kyou kara Ore wa Loli no Himo!;7.75/10;https://otakuteca.com/images/books/cover/5ea0e6633e2aa.jpg;Seinen;Comedia, Ecchi, Harem, Romance, Recuentos de la vida;2018;Siguiendo
La Vida Después de la Muerte;8.89/10;https://otakuteca.com/images/books/cover/5ddde8a92558c.jpg;Shounen;Acción, Aventura, Comedia, Drama, Magia, Reencarnación, Superpoderes;2018;Siguiendo
Viviendo En Este Mundo Con Cortar Y Pegar;0.00/10;https://otakuteca.com/images/books/cover/5b96be485dd63.jpg;Seinen;Acción, Aventura, Ecchi, Fantasia, Harem, Romance, Recuentos de la vida;2016;Siguiendo
Lo siento mucho Ojou Sama, pero a mí me gusta la sirvienta;7.50/10;https://otakuteca.com/images/books/cover/63a102143f18b.jpg;Shounen;Comedia, Drama, Romance;2022;Siguiendo
Mairimashita! Iruma-kun;9.36/10;https://otakuteca.com/images/books/cover/60dccc7dbac27.jpg;Shounen;Comedia, Fantasia, Sobrenatural, Demonios, Magia, Vida Escolar, Romance;2017;Siguiendo
Mamahaha no tsurego ga moto kanodatta;7.00/10;https://otakuteca.com/images/books/cover/5ccd0bf3b5c18.jpg;Shounen;Comedia, Romance, Vida Escolar;2019;Siguiendo
Soy el Rey Demonio. Me volví a casar con la madre de una heroína, así que ella se convirtió en mi hijastra;9.00/10;https://otakuteca.com/images/books/cover/5c6f76c965ddd.jpg;Seinen;Acción, Comedia, Fantasia, Magia, Romance;2019;Siguiendo
Mi esposa es demasiado perfecta, así que ¿puedo molestarla?;10.00/10;https://otakuteca.com/images/books/cover/641c2974d91fa.jpg;Shounen;Comedia, Romance, Recuentos de la vida, Ecchi;2021;Siguiendo
Boku no Heya ga Dungeon no Kyuukeijo ni Natteshimatta Ken;6.40/10;https://otakuteca.com/images/books/cover/635a4cfcaaa2e.jpg;Seinen;Aventura, Comedia, Romance, Ecchi, Harem, Fantasia, Recuentos de la vida;2017;Siguiendo
Mission: Yozakura Family;7.83/10;https://otakuteca.com/images/books/cover/6154c99c9be62.jpg;Shounen;Acción, Comedia, Romance, Crimen, Drama, Vida Escolar;2019;Siguiendo
Mizuki-senpai es una adivinadora de amor;8.50/10;https://otakuteca.com/images/books/cover/63a74bf3609d8.jpg;Seinen;Comedia, Romance, Vida Escolar, Recuentos de la vida;2020;Siguiendo
Mofu O Neesan No Atatame-kata;10.00/10;https://otakuteca.com/images/books/cover/5cef2e24c8d57.jpg;Seinen;Comedia, Romance, Recuentos de la vida;2019;Siguiendo
Mother of Learning;8.88/10;https://otakuteca.com/images/books/cover/35386_TMOManga5a728f7fe1e0d.jpg;Shounen;Acción, Aventura, Ciencia Ficción, Supervivencia, Fantasia, Magia, Misterio, Recuentos de la vida, Sobrenatural, Thriller, Vida Escolar;2011;Siguiendo
Munou na Nana;6.44/10;https://otakuteca.com/images/books/cover/619043314ff3c.jpg;Shounen;Psicológico, Sobrenatural, Vida Escolar, Drama, Horror;2016;Siguiendo
Musunde Hiraite;9.05/10;https://otakuteca.com/images/books/cover/14682_TMOmanga033414.jpg;Shounen;Comedia, Romance, Vida Escolar;2009;Siguiendo
My girlfriend is a Dragon;10.00/10;https://otakuteca.com/images/books/cover/5c6a101d96d81.jpg;Shounen;Comedia, Fantasia, Magia, Romance, Vida Escolar, Harem;2018;Siguiendo
Nega-kun to Posi-chan;8.20/10;https://otakuteca.com/images/books/cover/5f8de7846a83d.jpg;Shounen;Comedia, Romance, Vida Escolar;2019;Siguiendo
New Normal;10.00/10;https://otakuteca.com/images/books/cover/6025152849790.jpg;Seinen;Comedia, Romance, Recuentos de la vida, Drama;2020;Siguiendo
Ochikazuki ni Naritai Manga;10.00/10;https://otakuteca.com/images/books/cover/5e08138614a67.jpg;Shounen;Comedia, Romance, Vida Escolar;2019;Siguiendo
Oku-sama wa Niizuma-chan;8.50/10;https://otakuteca.com/images/books/cover/64ee25aec44ec.jpg;Seinen;Comedia, Romance, Recuentos de la vida;2019;Siguiendo
Okyu no Trinity;8.65/10;https://otakuteca.com/images/books/cover/62f04fb99b590.jpg;Shounen;Fantasia, Romance, Comedia;2017 - 2020;Siguiendo
OMOI GA OMOI OMOI-SAN;8.50/10;https://otakuteca.com/images/books/cover/61fe42d65703d.jpg;Shounen;Comedia, Romance, Vida Escolar;2019;Siguiendo
One Punch-Man;9.14/10;https://otakuteca.com/images/books/cover/5bc7cc1d2cf73.jpg;Seinen;Acción, Comedia, Ciencia Ficción, Artes Marciales, Parodia, Superpoderes;2012;Siguiendo
Oni Futatsu;9.06/10;https://otakuteca.com/images/books/cover/5ce5fc02621a6.jpg;Shounen;Acción, Comedia, Fantasia, Romance, Vida Escolar, Sobrenatural;2017;Siguiendo
Oni-san no Tokorohe Mairimashita;8.50/10;https://otakuteca.com/images/books/cover/5c4c98b58201a.jpg;Shoujo;Comedia, Fantasia, Romance, Recuentos de la vida;2018 - 2019;Siguiendo
Onizuka-chan to Sawarida-kun;8.75/10;https://otakuteca.com/images/books/cover/5f18c1ce473b9.jpg;Shounen;Comedia, Romance, Vida Escolar, Recuentos de la vida, Sobrenatural;2019;Siguiendo
Ore dake Haireru Kakushi Dungeon: Kossori Kitaete Sekai Saikyou;5.75/10;https://otakuteca.com/images/books/cover/5b74de6f8fec0.jpg;Shounen;Acción, Aventura, Fantasia, Harem, Romance, Comedia, Ecchi;2018;Siguiendo
Ore wo Suki Nano wa Omae Dake ka yo;6.53/10;https://otakuteca.com/images/books/cover/25002_TMOManga58f54c08891c9.jpg;Shounen;Drama, Romance, Vida Escolar, Comedia, Ecchi, Harem, Recuentos de la vida;2017;Siguiendo
¿Puedo aceptar tu propuesta de todos esos años?;8.00/10;https://otakuteca.com/images/books/cover/5bc569cb317af.jpg;Shounen;Comedia, Romance, Recuentos de la vida;2018;Siguiendo
Osananajimi ga Zettai ni Makenai Love Comedy;4.83/10;https://otakuteca.com/images/books/cover/60270b380ec74.jpg;Shounen;Comedia, Drama, Romance, Harem, Vida Escolar;2019;Siguiendo
Otaku ni Otoku na Gal Gurashi;10.00/10;https://otakuteca.com/images/books/cover/63e469bcbd5ab.jpg;Shounen;Comedia, Drama, Realidad, Romance, Vida Escolar, Recuentos de la vida;2021;Siguiendo
Otome Kaijuu Caramelize;9.67/10;https://otakuteca.com/images/books/cover/5b767735d6480.jpg;Shoujo;Comedia, Romance, Vida Escolar, Sobrenatural;2018;Siguiendo
Owari no Seraph;7.40/10;https://otakuteca.com/images/books/cover/6271c2399753b.jpg;Shounen;Acción, Sobrenatural, Aventura, Ciencia Ficción, Vampiros, Romance, Superpoderes;2012;Siguiendo
Pashiri na Boku to Koisuru Banchou-san;9.00/10;https://otakuteca.com/images/books/cover/61b386f1dbfbe.jpg;Shounen;Comedia, Vida Escolar, Recuentos de la vida, Romance, Drama, Realidad;2017 - 2021;Siguiendo
Player;8.00/10;https://otakuteca.com/images/books/cover/5f95ec683ee9f.jpg;Seinen;Acción, Aventura, Fantasia, Psicológico, Realidad, Reencarnación, Superpoderes;;Siguiendo
The Story Between a Dumb Prefect and a High School Girl with an Inappropriate Skirt Length;8.50/10;https://otakuteca.com/images/books/cover/6164202f663cb.jpg;Shounen;Comedia, Romance, Vida Escolar;2019;Siguiendo
Promised Orchid;9.50/10;https://otakuteca.com/images/books/cover/5e57c88696aa2.jpg;Seinen;Acción, Aventura, Demonios, Drama, Fantasia, Gore, Horror;2019 - 2021;Siguiendo
Pure Love ✕ Insult Complex;0.00/10;https://otakuteca.com/images/books/cover/5b2c4c7daa244.jpg;Seinen;Acción, Comedia, Harem, Artes Marciales, Psicológico, Romance, Tragedia;2011;Siguiendo
R15+ Ja Dame Desuka?;9.00/10;https://otakuteca.com/images/books/cover/62a5deeaac404.jpg;Seinen;Comedia, Romance, Vida Escolar, Recuentos de la vida;2022;Siguiendo
Re-Friendzone;10.00/10;https://otakuteca.com/images/books/cover/5b58ba8837740.jpg;Shounen;Comedia, Romance, Fantasia, Drama, Tragedia, Acción, Reencarnación;2017 - 2019;Siguiendo
Saliendo Con Una Chica Gamer;8.50/10;https://otakuteca.com/images/books/cover/6052cca389846.jpg;Seinen;Comedia, Romance, Recuentos de la vida;2018;Siguiendo
Shuumatsu no Valkyrie;9.19/10;https://otakuteca.com/images/books/cover/64737aec24c7e.jpg;Seinen;Acción, Historia, Artes Marciales, Samurái, Sobrenatural, Superpoderes, Tragedia;2017;Siguiendo
Release that witch;9.00/10;https://otakuteca.com/images/books/cover/633f6849ef27d.jpg;Seinen;Acción, Aventura, Fantasia, Harem, Reencarnación, Comedia, Magia;2018;Siguiendo
Retort Pouch!;8.70/10;https://otakuteca.com/images/books/cover/5e3861eec652c.jpg;Seinen;Comedia, Ecchi, Romance, Harem, Vida Escolar;2014 - 2018;Siguiendo
Rokujo Hito x ma (PIXIV);7.50/10;https://otakuteca.com/images/books/cover/5bfc6c683e136.jpg;Seinen;Demonios, Drama, Ecchi, Fantasia, Romance, Comedia;2018;Siguiendo
Sachiiro no one room;10.00/10;https://otakuteca.com/images/books/cover/30900_TMOManga59c1811e5e4ff.jpg;Shounen;Drama, Romance, Recuentos de la vida;2016;Siguiendo
Saeki-san wa Nemutteru;9.00/10;https://otakuteca.com/images/books/cover/5de7ddfcae6ac.jpg;Shounen;Comedia, Romance, Vida Escolar;2018 - 2020;Siguiendo
Saijo no Osewa: Takane no Hana-darake na Meimonkou de, Gakuin Ichi no Ojou-sama (Seikatsu Nouryoku Kaimu) wo Kagenagara Osewasuru Koto ni Narimashita;9.00/10;https://otakuteca.com/images/books/cover/60e1e7bfe095f.jpg;Shounen;Comedia, Romance, Vida Escolar, Recuentos de la vida, Harem;2021;Siguiendo
Sakura-chan to Amane-kun;8.98/10;https://otakuteca.com/images/books/cover/38494_TMOManga5ad75e2586c08.jpg;Shoujo;Género Bender, Vida Escolar, Romance;2018;Siguiendo
Sakurai-San Wa Kizuite Hoshii;7.56/10;https://otakuteca.com/images/books/cover/6186f4ffb2c72.jpg;Shounen;Comedia, Romance, Vida Escolar;2019;Siguiendo
"Seibetsu ""Mona Lisa"" no Kimi he.";9.06/10;https://otakuteca.com/images/books/cover/5c721d1ef1f63.jpg;Shounen;Drama, Recuentos de la vida, Romance, Vida Escolar, Psicológico;2018;Siguiendo
Sensei wa koi o oshie rarenai;9.77/10;https://otakuteca.com/images/books/cover/5fa6cfdb4b10d.jpg;Shounen;Romance, Vida Escolar, Comedia, Recuentos de la vida;2018;Siguiendo
Sensei, Kongetsu Dou Desu ka;8.00/10;https://otakuteca.com/images/books/cover/62db63f05bfe7.jpg;Seinen;Drama, Romance, Recuentos de la vida, Sobrenatural;2020;Siguiendo
Drawing While Masturbating;8.00/10;https://otakuteca.com/images/books/cover/5cc8a0ebc0ff3.jpg;Seinen;Comedia, Ecchi, Romance, Drama, Harem, Recuentos de la vida;2018;Siguiendo
Shindere Shoujo to Kodoku na Shinigami;9.12/10;https://otakuteca.com/images/books/cover/5f1296d0e8dfd.jpg;Shounen;Comedia, Recuentos de la vida, Sobrenatural, Misterio, Psicológico, Romance;2011;Siguiendo
Shinigami Bocchan to Kuro Maid;9.38/10;https://otakuteca.com/images/books/cover/5c17d4223ecb7.jpg;Seinen;Romance, Comedia, Sobrenatural, Drama, Ecchi, Tragedia;2017;Siguiendo
Shiunji-ke no Kodomotachi;7.40/10;https://otakuteca.com/images/books/cover/6213dd1d981f4.jpg;Shounen;Comedia, Romance, Vida Escolar, Drama, Recuentos de la vida;2022;Siguiendo
Siscon Ani to Brocon Imouto ga Shoujiki ni Nattara;7.50/10;https://otakuteca.com/images/books/cover/5b368af459e3c.jpg;Seinen;Romance, Comedia, Vida Escolar, Drama, Recuentos de la vida;2017 - 2020;Siguiendo
Solo Leveling;9.11/10;https://otakuteca.com/images/books/cover/5c2efcd42cd5e.jpg;Shounen;Acción, Sobrenatural, Comedia, Magia, Reencarnación, Apocalíptico, Romance;2017;Siguiendo
Sotodura Danshi no Shimizu-kun;0.00/10;https://otakuteca.com/images/books/cover/629fc5192f161.jpg;Shoujo;Comedia, Romance, Vida Escolar;2021;Siguiendo
Bunretsu Lover;0.00/10;https://otakuteca.com/images/books/cover/5ec2d2c9af43f.jpg;Shounen;Comedia, Ecchi, Harem, Romance, Vida Escolar, Sobrenatural;2018;Siguiendo
